{
  "$schema": "https://json-schema.org/draft/2020-12/schema",
  "$id": "https://cornermex.example/schemas/staging-readiness-execution-evidence-v1.json",
  "title": "CornerMex Staging Readiness Execution Evidence",
  "type": "object",
  "additionalProperties": false,
  "required": [
    "schemaVersion",
    "requestId",
    "founderDecisionId",
    "result",
    "targetEnvironment",
    "targetService",
    "variableName",
    "appliedContractValue",
    "priorValue",
    "valuesRedacted",
    "preChangeDeploymentId",
    "postChangeDeploymentId",
    "sourceSha",
    "healthBefore",
    "healthAfter",
    "readinessBefore",
    "readinessAfter",
    "supabaseReadiness",
    "rollback",
    "productionBefore",
    "productionAfter",
    "changeAppliedAt",
    "verifiedAt",
    "maximumEvidenceAgeSeconds",
    "remainingBlocker",
    "actionsNotExecuted"
  ],
  "properties": {
    "schemaVersion": { "const": "cornermex-staging-readiness-execution-evidence-v1" },
    "requestId": { "type": "string", "pattern": "^SRC-[0-9]{4}-[0-9]{2}-[0-9]{2}-[A-Za-z0-9-]+$" },
    "founderDecisionId": { "const": "FD-CM-STAGING-READINESS-001" },
    "result": { "enum": ["executed_verified", "executed_degraded", "rolled_back"] },
    "targetEnvironment": { "const": "staging" },
    "targetService": { "const": "cornermex-web" },
    "variableName": { "const": "CORNERMEX_COMMERCE_MODEL" },
    "appliedContractValue": { "const": "single_merchant_with_internal_supplier_network" },
    "priorValue": { "const": "[REDACTED]" },
    "valuesRedacted": { "const": true },
    "preChangeDeploymentId": { "type": "string", "format": "uuid" },
    "postChangeDeploymentId": { "type": "string", "format": "uuid" },
    "sourceSha": { "type": "string", "pattern": "^[0-9a-f]{40}$" },
    "healthBefore": { "$ref": "#/$defs/probe" },
    "healthAfter": { "$ref": "#/$defs/probe" },
    "readinessBefore": { "$ref": "#/$defs/readinessProbeInvalidSchema" },
    "readinessAfter": { "$ref": "#/$defs/readinessProbeSchemaValid" },
    "supabaseReadiness": {
      "type": "object",
      "additionalProperties": false,
      "required": ["executed", "result"],
      "properties": {
        "executed": { "type": "boolean" },
        "result": { "enum": ["reachable", "unreachable", "not_executed"] }
      }
    },
    "rollback": {
      "type": "object",
      "additionalProperties": false,
      "required": ["mechanism", "targetDeploymentId", "availabilityVerified", "performed"],
      "properties": {
        "mechanism": { "const": "railway_deployment_rollback_restores_custom_variables" },
        "targetDeploymentId": { "type": "string", "format": "uuid" },
        "availabilityVerified": { "const": true },
        "performed": { "type": "boolean" }
      }
    },
    "productionBefore": { "$ref": "#/$defs/productionState" },
    "productionAfter": { "$ref": "#/$defs/productionState" },
    "changeAppliedAt": { "$ref": "#/$defs/timestamp" },
    "verifiedAt": { "$ref": "#/$defs/timestamp" },
    "maximumEvidenceAgeSeconds": { "type": "integer", "minimum": 1, "maximum": 604800 },
    "remainingBlocker": { "type": ["string", "null"] },
    "actionsNotExecuted": {
      "type": "array",
      "minItems": 1,
      "uniqueItems": true,
      "items": { "type": "string", "minLength": 1 }
    }
  },
  "$defs": {
    "timestamp": { "type": "string", "pattern": "^\\d{4}-\\d{2}-\\d{2}T\\d{2}:\\d{2}:\\d{2}Z$" },
    "probe": {
      "type": "object",
      "additionalProperties": false,
      "required": ["statusCode", "status", "observedCommit"],
      "properties": {
        "statusCode": { "type": "integer" },
        "status": { "enum": ["ok", "degraded"] },
        "observedCommit": { "type": "string", "pattern": "^[0-9a-f]{12}$" }
      }
    },
    "readinessProbeInvalidSchema": {
      "description": "Shape of a live /api/ready response when environment schema validation itself failed (missing/malformed variables). This is the only path where src/routes/api/ready.ts includes `missing`/`errors` keys.",
      "type": "object",
      "additionalProperties": false,
      "required": ["statusCode", "status", "target", "missing", "errors"],
      "properties": {
        "statusCode": { "const": 503 },
        "status": { "const": "degraded" },
        "target": { "const": "unavailable" },
        "missing": { "type": "array", "items": { "type": "string" } },
        "errors": { "type": "array", "items": { "type": "string" }, "minItems": 1 }
      }
    },
    "readinessProbeSchemaValid": {
      "description": "Shape of a live /api/ready response once environment schema validation passes -- both the 200 ready path and the 503 Supabase-unreachable degraded path. Neither path returns `missing`/`errors` keys, so they must not be required here.",
      "type": "object",
      "additionalProperties": false,
      "required": ["statusCode", "status", "target"],
      "properties": {
        "statusCode": { "enum": [200, 503] },
        "status": { "enum": ["ready", "degraded"] },
        "target": { "enum": ["reachable", "unavailable"] },
        "missing": { "type": "array", "items": { "type": "string" } },
        "errors": { "type": "array", "items": { "type": "string" } }
      }
    },
    "productionState": {
      "type": "object",
      "additionalProperties": false,
      "required": [
        "deploymentId",
        "sourceSha",
        "deploymentCreated",
        "restartPerformed",
        "rollbackPerformed",
        "variableModified"
      ],
      "properties": {
        "deploymentId": { "const": "bac2a5b3-0b8a-4243-8046-531113a4ca18" },
        "sourceSha": { "const": "d470b7b57f6d625a7d60337ad16a59080c1bb37d" },
        "deploymentCreated": { "const": false },
        "restartPerformed": { "const": false },
        "rollbackPerformed": { "const": false },
        "variableModified": { "const": false }
      }
    }
  }
}
